name,price,category,sizes,stock,image_filename
Gucci Black Leather Belt Men,7999,Belts,"XS,S,M,L,XL",8,1pc New Fashion Luxury Belt For Men PU Leather Belt Metal Pin Buckle High Quality Famous Brand Designer Waist Strap Belts For Jeans Women Belt Plus Size.jpg
Prada Red Hot Leather Belt Women,6999,Belts,"S,M,L,XL",6,1pc Women's Multi-Color Snap Button PU Leather Belt, Versatile Jeans Accessory Waist Belt For Everyday Wear Summer, School.jpg
Louis Vuitton Gold Metal Buckle Belt Men,8999,Belts,"S,M,L,XL,XXL",7,download (90).jpg
Hermès Tan Leather Waist Belt Women,5999,Belts,"XS,S,M,L",5,men's watches and belts.jpg
Burberry Check Pattern Designer Belt Men,3999,Belts,"M,L,XL",9,Men's Designer Belts.jpg
