name,price,category,sizes,stock,image_filename,,,,
Louis Vuitton Essential Daypak Luxury Backpack Men,18999,Backpacks,B,5,15 Key Style Upgrades Every Man Should Make This Fall.jpg,,,,
Gucci Monogram Canvas Weekender Backpack Men,21999,Backpacks,B,7,BrandAlley _ Designer Sales - Up to 80% off Designer Clothing, Designer Bags, Homeware and Beauty.jpg,,
Prada Technical Nylon Backpack Unisex,19999,Backpacks,B,4,Designer Backpacks _ Men's Bags _ MR PORTER.jpg,,,,
Hermès Leather Travel Rucksack Executive,22999,Backpacks,B,6,download (95).jpg,,,,
Burberry Check Canvas Daypack Backpack Men,20999,Backpacks,B,8,Giveиc৸y 👝👗👠🛍👜.jpg,,,,
Dior Black Italian Leather Dress Belt Men,14999,Belts,B,6,1pc New Fashion Luxury Belt For Men PU Leather Belt Metal Pin Buckle High Quality Famous Brand Designer Waist Strap Belts For Jeans Women Belt Plus Size.jpg,,,,
Fendi Logo Buckle Suede Waist Belt Women,13999,Belts,B,5,1pc Women's Multi-Color Snap Button PU Leather Belt, Versatile Jeans Accessory Waist Belt For Everyday Wear Summer, School.jpg,,
Gucci GG Marmont Leather Belt Unisex,15999,Belts,B,7,download (90).jpg,,,,
Cartier Trinity Gold Plated Designer Belt Men,17999,Belts,B,4,men's watches and belts.jpg,,,,
Versace Medusa Buckle Premium Belt Men,16999,Belts,B,9,Men's Designer Belts.jpg,,,,
Rolex President Gold Chain Link Bracelet Men,22999,Bracleets,B,3,18k White Gold Mens Franco Chain Link Bracelet Retro Style Guys 18 Karat Jewelry _ Color_ Silver _ Size_ 8_.jpg,,,,
Hermès Leather Braided Bracelet Classic Men,14999,Bracleets,B,6,Braided Leather Bracelet _ Tommy Hilfiger.jpg,,,,
Cartier Precious Stone Turquoise Link Bracelet,18999,Bracleets,B,5,Natural Sleeping beauty turquoise stone link Chain Bracelet , Salman khan bracelet ,  Firozah Bracelet , Medium size bracelet _.jpg,
Saint Laurent Brown Leather Signature Bracelet Men,13999,Bracleets,B,7,SAINT LAURENT Leather Bracelet - Brown.jpg,,,,
Tommy Hilfiger Blue Heritage Leather Bracelet Men,9999,Bracleets,B,8,TOMMY HILFIGER Mens leather bracelet blue 2790549.jpg,,,,
Ralph Lauren Cotton Chino Classic Baseball Cap Men,8999,Caps,B,6,Cotton Chino Ball Cap _ Ralph Lauren.jpg,,,,
Prada Cord Snapback Premium Luxury Hat,12999,Caps,B,5,Modelo 5-Panel Cord Snapback Hat.jpg,,,,
Polo Ralph Lauren Embroidered Logo Baseball Cap,10999,Caps,B,4,Polo Ralph Lauren logo-patch cotton baseball cap - Blue.jpg,,,,
Aime Leon Dore Designer Snapback Cap Men,11999,Caps,B,7,Shop All at AimeLeonDore_com.jpg,,,,
Tommy Hilfiger Flag Logo Adjustable Baseball Cap,9999,Caps,B,8,Tommy Hilfiger Men's Cotton Logo Adjustable Baseball Cap.jpg,,,,
Louis Vuitton Avenue Sling Bag Luxury Men,21999,Handbags,B,8,Avenue Slingbag Luxury Belt - Black _ Grey - Men - Louis Vuitton®.jpg,,,,
Gucci Cargo Utility Wearable Wallet Bag,15999,Handbags,B,5,Cargo wearable wallet.jpg,,,,
Prada Technical Nylon Crossbody Bag Women,18999,Handbags,B,6,download (94).jpg,,,,
Louis Vuitton Avenue Premium Leather Satchel,22999,Handbags,B,3,Men's LV avenue a.jpg,,,,
Hermès Avenue Leather Shoulder Bag Unisex,21999,Handbags,B,7,Products by Louis Vuitton_ Avenue Slingbag PM.jpg,,,,
BORMAN Sapphire Luxury Leather Strap Watch Men,16999,Leather Strap,B,5,BORMAN 3868 Men's Automatic Watch – Sapphire Calendar Luxury 50M - luxury watch 5.jpg,,,,
BORMAN Automatic Mechanical Sapphire Premium Watch,17999,Leather Strap,B,6,BORMAN Mens Automatic Watches Luxury Watch Fashion Mechanical Wristwatches Waterproof Sapphire.jpg,,,,
Panerai Ferrari Engineered Heritage Watch Men,22999,Leather Strap,B,4,History Of Ferrari Watches_ Engineered by Officine Panerai - Quill & Pad.jpg,,,,
Lige Roman Numerals Luxury Leather Watch Men,11999,Leather Strap,B,7,Lige Men Watch Roman Numerals Leather Quartz Date Wristwatch Calendar Male Watch.jpg,,,,
Maurice Lacroix Classic Date Leather Watch Unisex,19999,Leather Strap,B,5,Maurice Lacroix Watch Les Classiques Date Mens  LC6098-SS001-120-1 Watch.jpg,,,,
Rolex Datejust 41 Premium Steel Watch,21999,Metal Strap,B,3,Datejust 41.jpg,,,,
Rado Original Black Ceramic Automatic Watch Men,18999,Metal Strap,B,6,Previously Owned Rado The Original Men's Watch R12391153 _ Jared.jpg,,,,
Rado True Black Ceramic Metal Strap Watch,19999,Metal Strap,B,5,Rado Men's True 40_1mm Black Ceramic Band & Case Automatic Watch R27100912.jpg,,,,
Parmigiani Fleurier Skeleton Platinum Blue Watch,22999,Metal Strap,B,4,TONDA PF SKELETON PLATINUM MILANO BLUE - Parmigiani Fleurier.jpg,,,,
Parmigiani Fleurier Skeleton Steel Graphite Watch,21999,Metal Strap,B,7,TONDA PF SKELETON STEEL PLATINUM GRAPHITE - Parmigiani Fleurier.jpg,,,,
Diesel Silver Statement Signet Ring Men,9999,Rings,B,6,DIESEL Men's Ring Silver.jpg,,,,
Diesel Silver Stainless Steel Logo Ring Men,10999,Rings,B,5,Diesel Men's Silver Stainless Steel Logo Signet Ring (Model_ DX1475040).jpg,,,,
Diesel Black Onyx Premium Designer Ring Men,11999,Rings,B,8,Diesel Ring.jpg,,,,
Gucci Ghost Shell Luxury Ring Unisex,13999,Rings,B,7,download (93).jpg,,,,
Fendi Silver Fish-Eye Signature Ring Women,14999,Rings,B,4,FENDI Silver Fish-Eye Ring.jpg,,,,
Gucci Minimal Square Wayfarer Sunglasses Men,15999,Sunglasses,B,5,download (92).jpg,,,,
Gucci Minimal Square 54mm Wayfarer Shades Men,16999,Sunglasses,B,6,Gucci Men's Minimal 54mm Square Wayfarer Sunglasses _ Dillard's.jpg,,,,
Celine Aviator Luxury Black Sunglasses Unisex,14999,Sunglasses,B,7,Lunettes.jpg,,,,
Persol Classic Aviator Dark Shade Sunglasses,13999,Sunglasses,B,8,Occhiali aviatore.jpg,,,,
Prada Symbole Rectangular Black Sunglasses Women,17999,Sunglasses,B,4,Prada Symbole Rectangular Women's Sunglasses, Pr 17WS - BLACK_DARK GREY.jpg,,,
Prada Dark Grey Rectangle Sunglasses Elegant,16999,Sunglasses,B,5,Prada Women's Sunglasses, Pr 08YS - Black_Dark Grey.jpg,,,
PUGLIA Black Frame Cat-Eye Sunglasses Premium,12999,Sunglasses,B,6,PUGLIA SUNNIES - BLACK - ONE SIZE.jpg,,,,
Saint Laurent Classic Black Frame Sunglasses,18999,Sunglasses,B,3,Saint Laurent Sunglasses at Neiman Marcus.jpg,,,,
Tom Ford Dax 48mm Polarized Square Shades Men,19999,Sunglasses,B,7,TOM FORD Men&#039;s Dax 48mm Square Polarized Sunglasses - Black_Blue.jpg,,,,
Versace Black Polarized Navigator Sunglasses Men,17999,Sunglasses,B,5,Versace Men&#039;s Polarized Navigator Sunglasses - Black.jpg,,,,
Gucci Black Leather Billfold Luxury Wallet,14999,Wallets,B,5,download (91).jpg,,,,
Lacoste Faux Leather Classic Billfold Wallet Black,10999,Wallets,B,6,Lacoste Faux Leather Billfold With Coin Pocket Wallet - Black.jpg,,,,
Louis Vuitton Saffiano Leather Billfold Wallet Silver,15999,Wallets,B,7,Saffiano Leather Billfold Wallet - One Size _ 003 Black_Silver _ 405931674.jpg,,,,
Saint Laurent Premium Leather Snap Wallet Black,16999,Wallets,B,4,Saint Laurent Wallets (32825 RSD) ❤ liked on Polyvore featuring men's fashion, men's bags, men's wallets, black, mens snap wallet and yves saint laurent mens wallet.jpg
YSL Black Heritage Leather Premium Wallet Men,15999,Wallets,B,8,YSL Wallet.jpg,,,,
