name,price,category,sizes,stock,image_filename
Gucci Black Leather Bifold Wallet Men,4999,Wallets,"S,M,L,XL",7,download (91).jpg
Lacoste Black Faux Leather Billfold Wallet Men,2999,Wallets,"M,L,XL",6,Lacoste Faux Leather Billfold With Coin Pocket Wallet - Black.jpg
Prada Saffiano Leather Billfold Wallet Men,5999,Wallets,"XS,S,M,L,XL",8,Saffiano Leather Billfold Wallet - One Size _ 003 Black_Silver _ 405931674.jpg
Saint Laurent Black Snap Wallet Men,4999,Wallets,"S,M,L",5,Saint Laurent Wallets (32825 RSD) ❤ liked on Polyvore featuring men's fashion, men's bags, men's wallets, black, mens snap wallet and yves saint laurent mens wallet.jpg
Yves Saint Laurent Leather Wallet Men,3999,Wallets,"M,L,XL,XXL",9,YSL Wallet.jpg
