name,price,category,sizes,stock,image_filename
Leather British Style Formal Shoes Men,45999,Formal Shoes,"7,8,9,10",6,British Style Shiny Leather.jpg
Leather Brogue Classic Formal Shoes Men,52999,Formal Shoes,"7,8,9,10",5,Leather brogues.jpg
Mens Dress Formal Shoes Men,48999,Formal Shoes,"7,8,9,10",7,Men's Dress Shoes.jpg
Mens Shiny British Style Formal Shoes Men,49999,Formal Shoes,"7,8,9,10",8,Mens British Style Shiny.jpg
Professional Fashion Formal Shoes Men,42999,Formal Shoes,"7,8,9,10",6,Shoes _ Mens Fashion Wear.jpg
